{"kind":"forecast","encoding":"training-grayscale-normalized","grid":{"id":"onix-station-png-732/448","shape":[448,448],"georeferenced":false},"lead_minutes":[6,12,18,24,30,36,42,48,54,60,66,72,78,84,90,96,102,108,114,120],"valid_times":["2023-11-30T09:48:00Z","2023-11-30T09:54:00Z","2023-11-30T10:00:00Z","2023-11-30T10:06:00Z","2023-11-30T10:12:00Z","2023-11-30T10:18:00Z","2023-11-30T10:24:00Z","2023-11-30T10:30:00Z","2023-11-30T10:36:00Z","2023-11-30T10:42:00Z","2023-11-30T10:48:00Z","2023-11-30T10:54:00Z","2023-11-30T11:00:00Z","2023-11-30T11:06:00Z","2023-11-30T11:12:00Z","2023-11-30T11:18:00Z","2023-11-30T11:24:00Z","2023-11-30T11:30:00Z","2023-11-30T11:36:00Z","2023-11-30T11:42:00Z"],"provenance":{"input_frames":[{"id":"frame-0","source":"preludio-cli","valid_time":"2023-11-30T09:24:00Z"},{"id":"frame-1","source":"preludio-cli","valid_time":"2023-11-30T09:30:00Z"},{"id":"frame-2","source":"preludio-cli","valid_time":"2023-11-30T09:36:00Z"},{"id":"frame-3","source":"preludio-cli","valid_time":"2023-11-30T09:42:00Z"}],"last_observation_time":"2023-11-30T09:42:00Z","model":{"id":"ghost-unet3d-step-22000","sha256":"7c5a6ed7865c0c85054ce45b2fb0b2f66694453491f7e6acabba14ee51533de8","schema":"preludio.model-package/1"},"generated_at":"2026-10-24T09:57:59Z","execution":{"target_id":null,"verified":false,"engine":"onnxruntime","engine_version":"1.31.0","provider":"cpu","threads":4,"platform":"macos-arm64"},"preludio_version":"0.1.0"}}
